{
  "message_id": "MSG-20260710-QA-REVIEW",
  "task_id": "RR0-REPOSITORY-STATE-RECONCILIATION-001",
  "from_role": "qa_reviewer",
  "status": "ACCEPT",
  "summary": "Independent QA accepts RR0 repository-state reconciliation at d50bc6a7de0872222026f4d41ba953295a9b6891. The R0 baseline state is internally consistent: origin/main is 23f9e0870304c1af70ec9e652dff17788259db59, exactly two known worktrees remain, the original M7 renderer worktree is preserved as non-active partial evidence with the expected dirty diff and schema-invalid writer handoff, the only active lead is 019eff50-c69d-7612-a90b-7024a47e0af5, there are no active writer/reviewer threads, branch inventory is 29 local and 21 unmerged, RR1 task count is zero, and the current RR0 branch diff is limited to allowed process/status/message paths with no business-code changes or deletions.",
  "artifacts": [
    "PROJECT_STATUS.md",
    "project/goal-mode-state.json",
    "project/model-routing-state.json",
    "project/tasks/thread-registry.json",
    "project/tasks/active/RR0-REPOSITORY-STATE-RECONCILIATION-001.json",
    "project/tasks/active/M7-STRATEGIC-TERRAIN-RENDERER-INTERACTION-001.json",
    "project/messages/outbox/RR0-REPOSITORY-STATE-RECONCILIATION-001__INVENTORY.json",
    "project/messages/outbox/RR0-REPOSITORY-STATE-RECONCILIATION-001__MSG-20260710-REVIEW__lead_orchestrator.json",
    "project/messages/outbox/RR0-REPOSITORY-STATE-RECONCILIATION-001__MSG-20260710-QA-REVIEW__qa_reviewer.json",
    "D:/WebProjects/MonsoonSovereigns/project/messages/outbox/M7-STRATEGIC-TERRAIN-RENDERER-INTERACTION-001__MSG-20260702-M7-STRATEGIC-TERRAIN-RENDERER-WRITER-REVIEW__client_engineer.json"
  ],
  "branch_or_worktree": "D:/WebProjects/MonsoonSovereigns-rr0-roadmap-adoption @ codex/rr0-repository-state-reconciliation-001",
  "commit": "d50bc6a7de0872222026f4d41ba953295a9b6891",
  "tests_run": [
    {
      "command": "git rev-parse HEAD; git rev-parse --abbrev-ref HEAD; git status --short --branch",
      "exit_code": 0,
      "result": "Target worktree is on codex/rr0-repository-state-reconciliation-001 at d50bc6a7de0872222026f4d41ba953295a9b6891 and was clean before this QA handoff file was written."
    },
    {
      "command": "git rev-parse origin/main",
      "exit_code": 0,
      "result": "origin/main is 23f9e0870304c1af70ec9e652dff17788259db59."
    },
    {
      "command": "git worktree list --porcelain",
      "exit_code": 0,
      "result": "Exactly two registered worktrees: D:/WebProjects/MonsoonSovereigns-rr0-roadmap-adoption on codex/rr0-repository-state-reconciliation-001 and D:/WebProjects/MonsoonSovereigns on codex/m7-strategic-terrain-renderer-interaction."
    },
    {
      "command": "git status --short; git diff --shortstat; git rev-list --left-right --count origin/main...codex/m7-strategic-terrain-renderer-interaction in D:/WebProjects/MonsoonSovereigns",
      "exit_code": 0,
      "result": "Original M7 worktree has 15 tracked modified entries, 5 untracked entries, tracked diff 2910 insertions/227 deletions, and branch relation 11 behind / 1 ahead."
    },
    {
      "command": "parse canonical M7 task file in origin/main and target RR0 worktree",
      "exit_code": 0,
      "result": "Canonical M7 task status is PARTIAL. The original dirty M7 worktree locally overlays that task file with IN_PROGRESS, which is retained dirty evidence rather than the canonical R0 ledger state."
    },
    {
      "command": "node .agents/skills/monsoon-studio-orchestrator/scripts/validate-handoff.mjs D:/WebProjects/MonsoonSovereigns/project/messages/outbox/M7-STRATEGIC-TERRAIN-RENDERER-INTERACTION-001__MSG-20260702-M7-STRATEGIC-TERRAIN-RENDERER-WRITER-REVIEW__client_engineer.json",
      "exit_code": 1,
      "result": "Expected invalid result confirmed: original M7 writer handoff lacks required schema fields and integer tests_run exit_code values."
    },
    {
      "command": "node .agents/skills/monsoon-studio-orchestrator/scripts/validate-handoff.mjs project/messages/outbox/RR0-REPOSITORY-STATE-RECONCILIATION-001__MSG-20260710-REVIEW__lead_orchestrator.json",
      "exit_code": 0,
      "result": "RR0 lead REVIEW handoff is schema-valid."
    },
    {
      "command": "node .agents/skills/monsoon-studio-orchestrator/scripts/taskctl.mjs validate RR0-REPOSITORY-STATE-RECONCILIATION-001",
      "exit_code": 0,
      "result": "Task JSON validates structurally and task status is REVIEW."
    },
    {
      "command": "node .agents/skills/monsoon-studio-orchestrator/scripts/taskctl.mjs list",
      "exit_code": 0,
      "result": "RR0-ROADMAP-ADOPTION-001 is CLOSED, RR0-REPOSITORY-STATE-RECONCILIATION-001 is REVIEW, remaining RR0 tasks are DRAFT, and M7 renderer is PARTIAL."
    },
    {
      "command": "node .agents/skills/monsoon-studio-orchestrator/scripts/taskctl.mjs ready",
      "exit_code": 0,
      "result": "No ready task output, matching the REVIEW gate state."
    },
    {
      "command": "git diff --check",
      "exit_code": 0,
      "result": "No whitespace errors."
    },
    {
      "command": "parse changed JSON files from git diff --name-only origin/main...HEAD -- *.json",
      "exit_code": 0,
      "result": "Seven changed JSON files parsed successfully."
    },
    {
      "command": "semantic parse of project/goal-mode-state.json, project/model-routing-state.json, project/tasks/thread-registry.json, task JSON, and inventory JSON",
      "exit_code": 0,
      "result": "Current milestone is R0, current task is RR0-REPOSITORY-STATE-RECONCILIATION-001, goal active roles contain only lead_orchestrator, registry active lead count is 1, inventory active_writer_or_reviewer_threads is empty, and stale M7 client close_agent result is not_found with fabricated_close_success=false."
    },
    {
      "command": "git branch --format and git branch --no-merged origin/main --format",
      "exit_code": 0,
      "result": "Branch inventory independently recomputed as 29 local branches and 21 local branches unmerged into origin/main."
    },
    {
      "command": "count project/tasks/active/RR1-*.json",
      "exit_code": 0,
      "result": "RR1_COUNT 0."
    },
    {
      "command": "git diff --name-only origin/main...HEAD with allowed/forbidden path assertion",
      "exit_code": 0,
      "result": "PATH_SCOPE_PASS across 8 changed paths; no apps, packages, tests, content-source, dependency, tooling, or GATE-M0-M6 paths changed."
    },
    {
      "command": "git diff --name-status origin/main...HEAD and git diff --name-status HEAD^..HEAD",
      "exit_code": 0,
      "result": "No deletions in the branch diff. Final commit d50bc6a7 changes only project/tasks/active/RR0-REPOSITORY-STATE-RECONCILIATION-001.json and project/tasks/thread-registry.json to register the QA reviewer thread."
    }
  ],
  "decisions": [
    {
      "id": "ACCEPT_RECONCILIATION",
      "decision": "All stated acceptance criteria are met at final review commit d50bc6a7de0872222026f4d41ba953295a9b6891."
    },
    {
      "id": "CANONICAL_M7_STATUS_SOURCE",
      "decision": "Use origin/main and the target RR0 worktree as canonical state for M7 status. The original M7 worktree remains dirty and must not be normalized during this task."
    },
    {
      "id": "NO_CLEANUP_OR_REPAIR",
      "decision": "No branch, worktree, M7 diff, or schema-invalid writer handoff was deleted, reset, repaired, or modified during QA."
    },
    {
      "id": "FINAL_COMMIT_SCOPE",
      "decision": "The user-specified final review commit only registers the real QA thread in allowed process paths and does not alter product behavior."
    }
  ],
  "risks": [
    {
      "id": "M7-PARTIAL-DIFF-DISPOSITION",
      "severity": "R3",
      "summary": "The preserved M7 renderer worktree still contains substantial unreviewed product changes and a schema-invalid PARTIAL writer artifact; a later explicit disposition task must decide split, salvage, or abandonment."
    },
    {
      "id": "INVENTORY-HEAD-TIMESTAMP",
      "severity": "R1",
      "summary": "The inventory file records the active RR0 worktree head at its audit time before the REVIEW handoff and QA-thread registration commits. The later commits were independently checked and only add the handoff and QA thread registration, so this is not a reconciliation blocker."
    }
  ],
  "blockers": [],
  "route_to": "lead_orchestrator",
  "requested_action": "Lead may accept this QA result and proceed with normal R0 reconciliation closure/integration gates. Do not resume or clean up the preserved M7 worktree except through a later explicit task.",
  "created_at": "2026-07-10T16:35:34.8416327+08:00"
}
