{
  "message_id": "MSG-20260710-SYSTEMS-R2-REVIEW",
  "task_id": "RR0-EXIT-VALIDATION-001",
  "from_role": "systems_architect",
  "status": "REVIEW",
  "summary": "Resolved the two R4 coordination-state inconsistencies reported by independent QA at edf959d3. model-routing now identifies origin/main e8f0050a and RR0-STATUS-LEDGER-COMPACTION-001 as the integrated baseline with no ready task, while goal-mode, model-routing, and continuation expose only the current RR0 Exit REQUEST_CHANGES_ROUTED_R2 route. The full R0 validation matrix passes, so the systems recommendation remains R0_GATE=PASS pending independent QA acceptance.",
  "artifacts": [
    "project/goal-mode-state.json",
    "project/model-routing-state.json",
    "project/messages/outbox/GOAL-MODE-CONTINUATION.json",
    "project/tasks/active/RR0-EXIT-VALIDATION-001.json",
    "project/messages/outbox/RR0-EXIT-VALIDATION-001__MSG-20260710-SYSTEMS-R2-REVIEW__systems_architect.json",
    "project/messages/outbox/RR0-EXIT-VALIDATION-001__MSG-20260710-QA-REVIEW__qa_reviewer.json",
    "project/messages/routes/RR0-EXIT-VALIDATION-001__ROUTE-20260710-QA-REQUEST-CHANGES-TO-SYSTEMS-R2.json"
  ],
  "branch_or_worktree": "D:/WebProjects/MonsoonSovereigns-rr0-roadmap-adoption @ codex/rr0-exit-validation-001",
  "commit": null,
  "tests_run": [
    {
      "command": "node R2 state consistency assertions across PROJECT_STATUS, goal-mode, model-routing, registry, continuation, route, task, and QA handoff",
      "exit_code": 0,
      "result": "Current task is RR0-EXIT-VALIDATION-001; model baseline is origin/main e8f0050a with RR0-STATUS-LEDGER-COMPACTION-001 and no ready task; all three route maps contain only the current REQUEST_CHANGES_ROUTED_R2 record; human_gate.required=false; unique active lead and Lead plus systems operational participants remain consistent."
    },
    {
      "command": "node .agents/skills/monsoon-studio-orchestrator/scripts/taskctl.mjs validate RR0-ROADMAP-ADOPTION-001",
      "exit_code": 0,
      "result": "VALID; status CLOSED."
    },
    {
      "command": "node .agents/skills/monsoon-studio-orchestrator/scripts/taskctl.mjs validate RR0-REPOSITORY-STATE-RECONCILIATION-001",
      "exit_code": 0,
      "result": "VALID; status CLOSED."
    },
    {
      "command": "node .agents/skills/monsoon-studio-orchestrator/scripts/taskctl.mjs validate RR0-PRODUCTION-FIXTURE-NOOP-AUDIT-001",
      "exit_code": 0,
      "result": "VALID; status CLOSED."
    },
    {
      "command": "node .agents/skills/monsoon-studio-orchestrator/scripts/taskctl.mjs validate RR0-STATUS-LEDGER-COMPACTION-001",
      "exit_code": 0,
      "result": "VALID; status CLOSED."
    },
    {
      "command": "node .agents/skills/monsoon-studio-orchestrator/scripts/taskctl.mjs validate RR0-EXIT-VALIDATION-001",
      "exit_code": 0,
      "result": "VALID; status REVIEW and route_to qa_reviewer."
    },
    {
      "command": "node .agents/skills/monsoon-studio-orchestrator/scripts/taskctl.mjs list",
      "exit_code": 0,
      "result": "First four RR0 tasks are CLOSED; RR0-EXIT-VALIDATION-001 is REVIEW."
    },
    {
      "command": "node .agents/skills/monsoon-studio-orchestrator/scripts/taskctl.mjs ready",
      "exit_code": 0,
      "result": "No task is ready; R1 remains frozen."
    },
    {
      "command": "node .agents/skills/monsoon-studio-orchestrator/scripts/validate-handoff.mjs project/messages/outbox/RR0-EXIT-VALIDATION-001__MSG-20260710-QA-REVIEW__qa_reviewer.json",
      "exit_code": 0,
      "result": "QA REQUEST_CHANGES handoff is schema-valid."
    },
    {
      "command": "node .agents/skills/monsoon-studio-orchestrator/scripts/validate-handoff.mjs project/messages/outbox/RR0-EXIT-VALIDATION-001__MSG-20260710-SYSTEMS-R2-REVIEW__systems_architect.json",
      "exit_code": 0,
      "result": "R2 systems REVIEW handoff is schema-valid."
    },
    {
      "command": "PowerShell here-string Node parser over git ls-files --cached --others --exclude-standard '*.json'",
      "exit_code": 0,
      "result": "Parsed 1441 repository JSON files with zero failures."
    },
    {
      "command": "git diff --check",
      "exit_code": 0,
      "result": "No whitespace errors."
    },
    {
      "command": "node forbidden-path assertions for 38ad1906..origin/main and origin/main..HEAD",
      "exit_code": 0,
      "result": "38ad1906..origin/main changed 40 paths and origin/main..HEAD changed 12 paths; both ranges contain 0 forbidden apps, packages, tests, content-source, CI, tools, dependency lock/manifest, MANIFEST/SHA, historical Gate, or R1 task paths."
    },
    {
      "command": "git worktree list --porcelain; git -C D:/WebProjects/MonsoonSovereigns status --short",
      "exit_code": 0,
      "result": "Exactly two worktrees remain registered; protected M7 worktree still has exactly 20 existing status entries."
    },
    {
      "command": "node R1 task zero-count and stale M7 active-route zero-count assertions",
      "exit_code": 0,
      "result": "R1/RR1 task file count is 0; stale M7 keys in active_routes and active_task_routes across all three coordination sources total 0."
    },
    {
      "command": "git status --short --untracked-files=all allowed-scope assertion",
      "exit_code": 0,
      "result": "Only the three authorized coordination-state JSON files, RR0 Exit task JSON, and new R2 systems handoff are changed."
    }
  ],
  "decisions": [
    {
      "id": "R0_GATE_RECOMMENDATION_R2",
      "decision": "R0_GATE=PASS remains the systems recommendation. Return to the same independent qa_reviewer; do not mark ACCEPTED or CLOSED here."
    },
    {
      "id": "QA_R4_COORDINATION_STATE_RESOLVED",
      "decision": "Corrected only the two QA-reported coordination-state defects: stale model-routing integration fields and stale M7 active route surfaces."
    },
    {
      "id": "SCOPE_AND_R1_FREEZE",
      "decision": "No active_threads, leadership, thread registry, PROJECT_STATUS, route, product, package, test, content, CI, dependency, historical Gate, or R1 task path was modified."
    }
  ],
  "risks": [
    {
      "id": "R1-AUTHORITATIVE-CLIENT-RUNTIME-GAP",
      "severity": "R4",
      "status": "recorded_for_r1",
      "summary": "Normal Web/Electron paths still lack authoritative Worker command/query/save/load wiring. This remains an R1 risk and is not hidden or reclassified by the R2 coordination-state repair."
    },
    {
      "id": "M7-RETAINED-PARTIAL-WORKTREE",
      "severity": "R3",
      "status": "preserved_non_operational",
      "summary": "The protected M7 worktree still has 20 retained entries and was verified read-only."
    }
  ],
  "blockers": [],
  "route_to": "qa_reviewer",
  "requested_action": "Independently re-run the R2 state-consistency and full R0 Gate assertions against the commit bound in this handoff. If accepted, route to Lead for status synchronization; otherwise return exact REQUEST_CHANGES evidence to systems_architect.",
  "created_at": "2026-07-10T21:24:15+08:00"
}
