{
  "message_id": "MSG-20260628-M6-BATCH-BALANCE-START",
  "task_id": "M6-BATCH-AUTORUN-BALANCE-DASHBOARD-001",
  "from_role": "lead_orchestrator",
  "status": "INFO",
  "summary": "Start M6-BATCH-AUTORUN-BALANCE-DASHBOARD-001 after M6-ACCESSIBILITY-CORE-FLOWS-001 closed on origin/main. The balance_analyst must implement local deterministic Alpha batch auto-run evidence and a read-only balance dashboard without telemetry, accounts, paid services, servers, hidden personal data, production analytics, automatic tuning, or authoritative save/WorldState payload expansion.",
  "artifacts": [
    "project/tasks/active/M6-BATCH-AUTORUN-BALANCE-DASHBOARD-001.json",
    "PROJECT_STATUS.md",
    "docs/04-software-architecture.md",
    "docs/05-coding-standards.md",
    "docs/06-delivery-workflow.md",
    "docs/14-multi-agent-operating-model.md",
    "docs/23-milestone-acceptance-matrix.md",
    "docs/27-autonomous-goal-mode.md",
    "apps/sim-runner/**",
    "packages/sim-ai/**",
    "packages/sim-core/**",
    "packages/ui/**",
    "apps/web/**",
    "tests/**"
  ],
  "branch_or_worktree": "feat/m6-batch-autorun-balance-dashboard / D:\\WebProjects\\MonsoonSovereigns",
  "commit": "3d725f8979ccaf26e552d0248d0cbe982587e232",
  "tests_run": [
    {
      "command": "node .agents/skills/monsoon-studio-orchestrator/scripts/taskctl.mjs validate M6-ACCESSIBILITY-CORE-FLOWS-001",
      "exit_code": 0,
      "result": "Previous task validated CLOSED after closure merge."
    },
    {
      "command": "node .agents/skills/monsoon-studio-orchestrator/scripts/taskctl.mjs ready",
      "exit_code": 0,
      "result": "M6-BATCH-AUTORUN-BALANCE-DASHBOARD-001 is dependency-ready."
    },
    {
      "command": "git status --short --branch",
      "exit_code": 0,
      "result": "main was clean and synchronized with origin/main before branch creation."
    }
  ],
  "decisions": [
    "Start M6-BATCH-AUTORUN-BALANCE-DASHBOARD-001 as the next dependency-ready M6 task after M6-ACCESSIBILITY-CORE-FLOWS-001 closure entered origin/main.",
    "Scope is local Alpha batch balance evidence and read-only dashboard only; no telemetry or live analytics.",
    "Batch outputs must be deterministic, schema-versioned, bounded, reproducible, and non-authoritative.",
    "Balance evidence may identify P0/P1 candidates and tuning risks, but must not automatically change content or simulation rules.",
    "Manual node battle remains DEFER_MANUAL_NODE_BATTLE; server/multiplayer/accounts/secrets/paid services/runtime SQL/ORM are excluded."
  ],
  "risks": [
    "R3 work crosses sim-runner/sim-ai/sim-core/client/UI/test surfaces; independent qa_reviewer acceptance is required.",
    "Batch artifacts must stay small and local; accidental telemetry, production analytics, or authoritative save/state expansion would be scope drift.",
    "Balance dashboard must be read-only over generated artifacts and must not become a tuning authority."
  ],
  "blockers": [],
  "route_to": "balance_analyst",
  "requested_action": "Implement within allowed paths, run required tests, record deterministic batch/dashboard evidence, and emit REVIEW handoff routed to qa_reviewer.",
  "created_at": "2026-06-28T00:33:12.367+08:00"
}
