{
  "task_id": "PROCESS-LEAD-TRANSITION-001",
  "message_id": "MSG-20260625-LEAD-TRANSITION-QA-REVIEW",
  "from_role": "qa_reviewer",
  "status": "ACCEPT",
  "summary": "Read-only process checkpoint review accepted LEAD-TRANSITION-PREPARE-001. The transition payloads are parseable, preserve null outgoing/successor thread IDs, leave no active child threads in goal/transition state, keep M3-TRIBUTE-TROOP-OBLIGATIONS-001 unstarted, and provide enough persisted state for a new GPT-5.5 xhigh lead_orchestrator to recover from origin/main.",
  "artifacts": [
    "project/messages/outbox/LEAD-TRANSITION-PREPARE-001.json",
    "project/messages/outbox/GOAL-MODE-CONTINUATION.json",
    "project/goal-mode-state.json",
    "project/model-routing-state.json",
    "project/tasks/thread-registry.json",
    "project/messages/outbox/PROCESS-LEAD-TRANSITION-001__MSG-20260625-LEAD-TRANSITION-QA-REVIEW__qa_reviewer.json"
  ],
  "branch_or_worktree": "chore/lead-transition-prepare",
  "commit": "268569409f8ced18c19b891c7e183d4018cc23cd",
  "tests_run": [
    {
      "command": "git status --short --branch",
      "exit_code": 0,
      "result": "Branch chore/lead-transition-prepare; modified project/goal-mode-state.json and project/model-routing-state.json; untracked transition outbox files only before this review evidence."
    },
    {
      "command": "git rev-parse origin/main",
      "exit_code": 0,
      "result": "268569409f8ced18c19b891c7e183d4018cc23cd"
    },
    {
      "command": "git diff --check",
      "exit_code": 0,
      "result": "No whitespace errors."
    },
    {
      "command": "git diff --name-only HEAD",
      "exit_code": 0,
      "result": "Only project/goal-mode-state.json and project/model-routing-state.json were tracked diffs before this review evidence."
    },
    {
      "command": "git ls-files --others --exclude-standard",
      "exit_code": 0,
      "result": "Only project/messages/outbox/GOAL-MODE-CONTINUATION.json and project/messages/outbox/LEAD-TRANSITION-PREPARE-001.json were untracked before this review evidence."
    },
    {
      "command": "node .agents/skills/monsoon-studio-orchestrator/scripts/taskctl.mjs list",
      "exit_code": 0,
      "result": "M3-SUCCESSION-STATE-MACHINE-001 is CLOSED; M3-TRIBUTE-TROOP-OBLIGATIONS-001 is DRAFT; no task is IN_PROGRESS."
    },
    {
      "command": "node .agents/skills/monsoon-studio-orchestrator/scripts/taskctl.mjs ready",
      "exit_code": 0,
      "result": "Only M3-TRIBUTE-TROOP-OBLIGATIONS-001 is dependency-ready."
    },
    {
      "command": "node .agents/skills/monsoon-studio-orchestrator/scripts/taskctl.mjs validate M3-SUCCESSION-STATE-MACHINE-001",
      "exit_code": 0,
      "result": "VALID project/tasks/active/M3-SUCCESSION-STATE-MACHINE-001.json."
    },
    {
      "command": "node -e JSON parse/shape checks for transition files, goal-mode state, model-routing state, thread registry, active task statuses, and duplicate thread IDs",
      "exit_code": 0,
      "result": "All required JSON parsed; lead status PREPARED; transition_status PREPARED_AWAITING_SUCCESSOR; outgoing_thread_id and successor_thread_id null; active transition and goal threads empty; no duplicate thread IDs; no IN_PROGRESS tasks."
    },
    {
      "command": "node .agents/skills/monsoon-studio-orchestrator/scripts/validate-handoff.mjs project/messages/outbox/M3-SUCCESSION-STATE-MACHINE-001__MSG-20260625-M3-SUCCESSION-LEAD-ACCEPT__lead_orchestrator.json",
      "exit_code": 0,
      "result": "VALID."
    },
    {
      "command": "node .agents/skills/monsoon-studio-orchestrator/scripts/validate-handoff.mjs project/messages/outbox/M3-SUCCESSION-STATE-MACHINE-001__MSG-20260625-M3-SUCCESSION-QA-R3-REVIEW__qa_reviewer.json",
      "exit_code": 0,
      "result": "VALID."
    },
    {
      "command": "node .agents/skills/monsoon-studio-orchestrator/scripts/validate-handoff.mjs project/messages/outbox/M3-SUCCESSION-STATE-MACHINE-001__MSG-20260625-M3-SUCCESSION-SYSTEMS-R3-REVIEW__systems_architect.json",
      "exit_code": 0,
      "result": "VALID."
    }
  ],
  "decisions": [
    "Accept the leadership transition checkpoint as a process handoff, not a gameplay task.",
    "Do not start M3-TRIBUTE-TROOP-OBLIGATIONS-001 during this review.",
    "Treat thread IDs as session-local hints; no successor_thread_id or outgoing_thread_id was invented."
  ],
  "risks": [
    "Non-blocking: project/goal-mode-state.json still records last_main_commit 3e3455d8da7276f677c142db6bef6a424fc5707b while HEAD/origin/main are 268569409f8ced18c19b891c7e183d4018cc23cd. The transition and continuation files carry the current origin/main and require the successor to re-run git/task checks before continuing."
  ],
  "blockers": [],
  "route_to": "lead_orchestrator",
  "requested_action": "Integrate or persist this ACCEPT review evidence, then have the successor lead_orchestrator verify from origin/main before deciding whether to start M3-TRIBUTE-TROOP-OBLIGATIONS-001 through the normal workflow.",
  "created_at": "2026-06-25T14:33:11.616Z"
}
