{
  "message_id": "MSG-20260624-FOUNDATION-007-QA-FOLLOWUP-ACCEPT",
  "task_id": "FOUNDATION-007",
  "from_role": "qa_reviewer",
  "status": "ACCEPT",
  "summary": "Accepted the follow-up CI delta. The duplicate pnpm version configuration was removed from all pnpm/action-setup@v4 steps in PR and nightly workflows, leaving package.json packageManager as the single pnpm version source. Remote PR checks for head 100e6e45dd059194132d5bc4ad0f060bd6592246 passed.",
  "artifacts": [
    ".github/workflows/pr.yml",
    ".github/workflows/nightly.yml",
    "project/messages/routes/FOUNDATION-007__ROUTE-20260624-QA-FOLLOWUP.json"
  ],
  "branch_or_worktree": "chore/foundation-007-ci-artifacts",
  "commit": "100e6e45dd059194132d5bc4ad0f060bd6592246",
  "tests_run": [
    {
      "command": "gh pr checks 9",
      "exit_code": 0,
      "result": "Quality, Web, and Browser Smoke passed; Windows Desktop Smoke Artifact passed."
    },
    {
      "command": "rg -n \"pnpm/action-setup|version:\\\\s*11|packageManager\" .github/workflows package.json",
      "exit_code": 0,
      "result": "No workflow version: 11 remains; package.json remains the single pnpm version source through packageManager."
    },
    {
      "command": "git diff --name-status HEAD~1..HEAD",
      "exit_code": 0,
      "result": "Only .github/workflows/nightly.yml and .github/workflows/pr.yml changed."
    },
    {
      "command": "git diff --check",
      "exit_code": 0,
      "result": "No whitespace errors."
    },
    {
      "command": "node .agents/skills/monsoon-studio-orchestrator/scripts/taskctl.mjs validate FOUNDATION-007",
      "exit_code": 0,
      "result": "VALID FOUNDATION-007 task JSON."
    },
    {
      "command": "node .agents/skills/monsoon-studio-orchestrator/scripts/validate-handoff.mjs project/messages/outbox/FOUNDATION-007__MSG-20260624-FOUNDATION-007-RELEASE-REVIEW__release_engineer.json",
      "exit_code": 0,
      "result": "VALID release handoff."
    }
  ],
  "decisions": [
    "Accepted the fix because it directly addresses the GitHub Actions pnpm/action-setup failure and remote PR checks now pass."
  ],
  "risks": [],
  "blockers": [],
  "route_to": "lead_orchestrator",
  "requested_action": "Lead may keep FOUNDATION-007 accepted and proceed with PR integration.",
  "created_at": "2026-06-24T03:37:47Z"
}
